{
  "schema_version": 1,
  "receipt_type": "batch",
  "batch_id": "batch-20260729015558",
  "source_comment_ids": [
    5084273959,
    5084371265,
    5084371842,
    5084513198,
    5084615360,
    5084618903,
    5084631726,
    5086001616,
    5086581050,
    5086739477,
    5086776533,
    5086782072,
    5087003873,
    5087015504,
    5087016408,
    5087203227,
    5087215771,
    5087810146,
    5087811634,
    5087813069,
    5090585819,
    5090737316,
    5091296179,
    5091298564,
    5091616990,
    5091741767,
    5092077646,
    5092124832,
    5092283173,
    5092416182,
    5092534822,
    5092939596,
    5093354729,
    5093443275,
    5093570562,
    5093573986,
    5093721405,
    5099222599,
    5101322347,
    5102209956,
    5102212360,
    5102214604,
    5103241826,
    5103243521,
    5103264920,
    5103766640,
    5103841186,
    5104654751,
    5105579627,
    5106087155,
    5106089599,
    5106093400,
    5106397902,
    5106846261,
    5106848617,
    5106850616,
    5107261113,
    5111845296
  ],
  "source_body_sha256": {
    "5084152024": "680a84585519be6c645738d6446ad29fd524c12754abaa04e5ec47b54b18a9fd",
    "5084273959": "934dc08077fab2cc74c26af92ae87db176e79d243f5195b727cb5f2f2a2a37e6",
    "5084371265": "0a73d7f02a7cb897517ccc84e0e42ddbb34fd4c58a153a363dd1d8c07163a22f",
    "5084371842": "85cef2c42f1b89f6669c3c9f8f70f55f2bb37494cf1937c9ff62bd38067a627b",
    "5084513198": "b3cad7d8cfde9e0540eaf5827e352d069ba3c80b4c81faba52a035d8129e61d2",
    "5084615360": "ae8d854f1a4ed22776557cfa646c38056dff66ae160ae6a81dd24cd5755f3069",
    "5084618903": "43977de4d74e42b249555bd47d2bfc4029bbe3cfb6ea46f754ededb438a9c0cd",
    "5084631726": "3c170d8add02bd181f3d592ded601ed4983d027da20637fc0bee899d3408ff4c",
    "5086001616": "744f658a4be2b64cc5020e64b3df7b48374782dfc0eb35ebf7113aa82e6f7e94",
    "5086578921": "bd58381dac471818efd7cff35286050fd01d50623bccc45645a8f6aada5f6983",
    "5086581050": "1c963a48a4f76c1c8015b6d4a3bd6aafb47449eccdd38a4f4385199588f687d2",
    "5086585134": "9a1835c8ee93eafd7bed34145e0e924d91f1520e7586bac4ce4c191257b36f42",
    "5086589429": "14598e3c1e38044ffcb4277b23141698cc9d3c14b206f577be2437e050603fe6",
    "5086624137": "2205142bd0862ed0a9b281e615bc4d3d86f839c03cef1ca84a91fc26a8ceeae2",
    "5086673654": "aee7818177cdb4d117705b24e72bbbe7edbd711fe55059d1b066ac9be724c37c",
    "5086705192": "b6bf6cf04f8e13ecca19833372fc042391b49764e8c89303ef049cfa1073802c",
    "5086739477": "1b2326c6818afd880f31a37b75049df397d2f0b3e4b52f0093db9af53f2e5e62",
    "5086776533": "cb9740bf0748ec81f7232cf9a83ff8f9b53508b71896baa526a3d2762aa04b0b",
    "5086781596": "d2be2c1e22fb136edbba0b7c2a92df74c8a1e56028d9f9b7a355781791bc159f",
    "5086782072": "417b1175d3d478fd1f239e7cb5942d76090518551050a509001bfc232bfbcd4e",
    "5087003873": "2cd345d0332207ac58ed62d1448fb6bfe2d8b604d166bf2256747315426c75f3",
    "5087015504": "763906db9ebd981b1dbe4edc4c0af8a3225c792bbcd661b217926c715efa7223",
    "5087016408": "baf889fe162e1ee1865dd5625cc4881ff9903dc56bc55b014aacce09b4a2f5bb",
    "5087030694": "56e169a502ed2db7e2b114896a3488536aa652f4ccca56592fffc02ca9eb3647",
    "5087203227": "1faa09dec7132de1ac20cd0d11b7a258e965e05593d775673f98e2bd75111e49",
    "5087215771": "8317f078d28c65f82640734def386ef2ba3844d1dc73eaae66290fda8dea5d40",
    "5087404562": "0722d4ee875d02997aa521a3d86cca4709d95b9ba9f8acab44e450fbe83e157c",
    "5087456754": "4b562b94daf2d8ab7e549decd6360b4a4bc773bf7247d6f4a9d8bf5bf222f8b0",
    "5087518655": "ce0a5f4147d60a09ff036c6ff026b68fd62f6833d63a19aef5a2b05e18781eb7",
    "5087613135": "72ae9287cc1c5f07c9ac9bc0747d65b7da84138e36b89b262860dc86fd253825",
    "5087810146": "9711d8b29577fa4fc78f096cd794869fffb7a4e5523d8b914f68e411316a7220",
    "5087811634": "b5d427ef2fa2dfc7ff9fcf84f1f9b9d920c753112d2b7af94b791eb1f3dbcd2d",
    "5087813069": "035c6f3b2a38dfd7a0252bad9edee6b4bb5ebea7aa9bfc455dc2221b9bb8afe7",
    "5087820732": "2ba11e9b04463c1274475e673fc92f2b82542378db25402146884ac972ed95ff",
    "5087822478": "4b30e7b4c54ed0ad1170f1171d5ee85e8cae3b07abfb29a20a49c2f8772b9fbb",
    "5087826613": "e647e0e25112743c33b14d6204924058eafbf45c323e7daabbabe9a8c52bc3eb",
    "5088140090": "b7b0e884518daf431bf7dca7af6ff0d34d3d93cd7f36cd56df760b62cdb16d92",
    "5088187239": "b60d1cfe572c80c05e6dd5f0d333b8dbda1d73c62f2205e21c1c08f52191fffd",
    "5088271091": "4e4e9cae77d3849968b03788269db94bc83f70d2139373a3220248707b545bcc",
    "5088331426": "a4eec64854200618fcf6838f0cf019a40abf8ff22536820cfe0134979c8e2cc2",
    "5088919064": "cd9516b7ebab8d4ddfa31676a4308fb75978f237ae04b989138396fb9a235b18",
    "5089028662": "ad645b8911b37674a0a675815cd389acdddfe8c19c9bb91e2704b278501b766d",
    "5090571993": "a857c135de6f0594706ff53cc74b1d49ee5e8cc75ebc01559540c172e4042003",
    "5090573860": "95caf93730fc75fe77b3b4e0229fc20f98cdf6b042bc3b4d1870b1f78e63089b",
    "5090577133": "e296576501a535b06e266bba8067ec4b3a0b965653c9068f33026b6173042e61",
    "5090585819": "cb2222c7e435a9cb5c092c886036afc78a809b4f7ebdffd39417feed61f69799",
    "5090737316": "bb96fec210f82c5805928300a99809d026e3eb0791a6165741bdcc1a0bc72ad7",
    "5091296179": "d91e96b4c19d5e23e16a16a0ded66ff3f11df337eba4cf433df9cf7c9c521572",
    "5091298564": "8feb78e65a7fc9f3a1622b70cab268880098c775cba73e17397e619c1c0c1c0a",
    "5091616990": "93635e37e23a1d4e6063f38665222aa7778754058da5fd1858e7388b8ea147a1",
    "5091741767": "509a5a529bb7bcea4d6c95ba9e3857941e0c7c75f63c9526182797988cc5322d",
    "5092077646": "0def7a7f627b59736da2af6417ce525445630dd97040603052c6fd0221a61910",
    "5092124832": "a50c566cb54cee2207d99a4088b6954137bdda7bddefe63a98e034a8a1bdb938",
    "5092283173": "0bd6682c026524d75d33a2cde564c10d6f1de81a72bfa951bb746b98d9583301",
    "5092416182": "cfaf0cc993b9faca329fc5c14e070b612b8624fe339633350df5bda804c66396",
    "5092513574": "a19d3b4fdd94d57f85ec4a77a55e4df6ad94546e693ee5b7730bc1534217ae1a",
    "5092534822": "0e260c10d061b935f17530d3b41ad22535275ddb9c276f021a6ce7a104a98f9f",
    "5092939596": "28e4b0eb1d0418f1aac5ebff5a606b33e9b15e20d34ce03bb0173b1e38f4902b",
    "5093354729": "8e8ffdf82fcf4e0e9e0107a48575f5d02cca9116bfdb7d246f35e6e90076f975",
    "5093443275": "fc6ee9726aced61ed3d0af65202e80c7a22309786ef5b25d2bece5d87533be1a",
    "5093570562": "afa31e15bbd5de4399f1d24bc45953e2e080fe3578ae3130e8a5b0c3c078b6ba",
    "5093573986": "81470490b30bade2f848d99c0417c07c94820678829b0a1ee3b24511c746df5e",
    "5093721405": "29c711cac268d01e9a45222a1a61d66ba4dfc630fa5128445deaad4bed4948cb",
    "5094470896": "1fd95f71d526af691f825ce4fee697e9a3be2add8e0531f07177793dfdf416e6",
    "5094473607": "5d746be97dbb6c61316216b53e0b0524f069cb6c7e5232834a7adecb39db9977",
    "5094475350": "c9027cd51f8e3949dbc066824a05e8f0beb071240d98ba751c35378a5c3286ee",
    "5098280170": "dcaa63fac36b624e0e9f3d6f9aa8428fbcd7b80d11d2728f2010ead03ccd01b9",
    "5098924212": "fb0c443807fc3093b298822d7259506b0963eae5c7e951add914366a3eb28999",
    "5099204973": "e4d8d7ab27ee0394fdb4149f2d9e9984cde128fc4cfa7515484c373ae56788d1",
    "5099206215": "a075406ed35e7af2a28bc8efdf67a2ad8c21f08ee209cb5643d987376c8b9c96",
    "5099222599": "51a70aa29576b37ede4985c220bdc3d31680c6582f9ae031457939193b2aa10a",
    "5101322347": "21579e62034c953db0e1670e691e0e009e5d57c27b8e781ddb6af8fa5c419f68",
    "5102209956": "ad85cce05447d3b9029644cf1638d5f98939c14c05e11657675358691d461f97",
    "5102212360": "7a7f039d5c7c3ef7858d151f01f5e3170c17e4a8fd04cc21e9bae6ce1c3a3fa0",
    "5102214604": "515b81bfe6626d75106f9da7e806226cafcd263f4bd2bfa34cb0459acef5a607",
    "5102373384": "e2206bbc7e4b81d3d79d2a040072d9a50c3b07310f46cb7327737fb23cc593e2",
    "5103241826": "18ba99b6511436c2802cb4706dd180f66110ba68732b9454a2857abf91a478de",
    "5103243521": "50f6eef3687657c99eaf175535ad940a34c2578c2f5e2c733fbf79f4f956a1cc",
    "5103264920": "69a2b00a4093f0ff76550d7a03c89cacf10829acaa47ddbae345cc92cb21c5cf",
    "5103766640": "25f0b285b8ecf454b2dc43b6eda9fa02f9ab16d406e28386995b36aad6c1bb04",
    "5103841186": "d89c7d001e5890e1f2b741f8735dde4db18a5d0c94b7e59dba18879af32bd69d",
    "5104294737": "57174e3e08770371bbb484f355e6844a72c683458fdb5e14f6975a24005602ea",
    "5104654751": "6d89a1c0283bb9a7becb172d62bb0348eca39b1507a25578c59279ef8139a947",
    "5104670197": "b04d211affd43d750675424b3915f0ca0c07eb2599e7be57a9810aaf767a2bfa",
    "5105554288": "25761cbb9d34ce5bbb21fed4beb49401e6cbad4d37c10030745fa9010fb7912d",
    "5105579627": "a997b0fa3b587629be159930f25ac38924186efb38c129a45aa48234c0088169",
    "5106087155": "2973873b70676ac23b19e478094d5ac2c7e405b2f5aed7a03147e16d37fc520d",
    "5106089599": "8c61fa1e5e4f2e47f1864e2944c6d75e6b67369dd499b0b38ba694b03197d89c",
    "5106093400": "8ed3379c2bd47a3f8a6f483d20e4082fa554510eb15171fe377d5bbd1a510364",
    "5106096425": "88aff922f91803e50f656b60b19f62da3f4062b710c16b14e37e74ef86260966",
    "5106388964": "e7050aeaf1158fb246f101ab957a41e0114c9fd0f33d1221a62b633b3e2ed9d4",
    "5106397902": "2bdbd0f6ca4806a35d1cd849dd5d86a9b229736c2cf0d704e0634991e7f4eac0",
    "5106846261": "1e5c7a0810bace03ec4db9545af6ac12d9d6378627a8e842967318436c2dd6f7",
    "5106848617": "951ca3e4f7324900b81e5d3547ce065b2690399b0f8f7829d315ddfa81d6465f",
    "5106850616": "9a9613703adadf3d2dcbb38a1387f256fccac5f3d55a25f2d1de4c764e2d4212",
    "5107261113": "cc4774d545977542cb0c88d34dd53b99c3940526fb3d65999628f9650467bad3",
    "5111845296": "3109f54b409e905ffc65cf8dfef476d361c6229fc089430bbabd2d6c4784d1df"
  },
  "admitted_run_ids": [
    "019f9ee5-8959-7351-bf3c-6e440b810d77",
    "platform-post-merge-review-remediation-20260726-01",
    "skr-production-dependency-remediation-20260726-01",
    "platform-post-merge-review-remediation-amendment-20260727-02",
    "019f9f66-5e5c-7222-a907-f222fd291a16",
    "2026-07-27-gpt-5-6-sol-governance-tooling-a-architecture-reset-008",
    "019f9f62-12f0-73b2-a930-d3dda2b091bd",
    "skr-production-dependency-remediation-amendment-20260727-02",
    "2026-07-27-gpt-5-6-sol-governance-tooling-a-architecture-reset-009",